{
  "protocol_version": 3,
  "playback_attempt_id": "attempt-golden-0001",
  "session_id": "11111111-1111-4111-8111-111111111111",
  "plan_id": "plan:478677870860e5e5108c18bff749b34b",
  "plan_attempt_id": "plan-attempt-golden-0001",
  "plan_attempt_key": "v3:f0144c47fa349e3e",
  "event": "plan_summary",
  "output_context_id": "7",
  "diagnostics": {
    "played_ms": "600000",
    "stall_count": "2",
    "stall_total_ms": "8000",
    "stall_longest_ms": "6000",
    "delivered_kbps": "63000",
    "buffering_mode": "always",
    "buffering_action": "lowered"
  }
}
